,Title,Year,Rated,Released,Runtime,Genre,Director,Writer,Actors,Plot,Language,Poster,Metascore,imdbRating,BoxOffice,Production
211,Peter Rabbit 2: The Runaway,2021,PG,11 Jun 2021,93 min,"Animation, Adventure, Comedy",Will Gluck,"Will Gluck, Patrick Burleigh, Beatrix Potter","Rose Byrne, Domhnall Gleeson, David Oyelowo","Thomas and Bea are now married and living with Peter and his rabbit family. Bored of life in the garden, Peter goes to the big city, where he meets shady characters and ends up creating chaos for the whole family.",English,https://m.media-amazon.com/images/M/MV5BYjkyMDQyZWQtNGFhYy00NjdmLWEzMjctYzAxMmJkNDkxZmRlXkEyXkFqcGdeQXVyMDA4NzMyOA@@._V1_SX300.jpg,43,6.2,"$31,236,832",N/A
212,PAW Patrol: The Movie,2021,G,20 Aug 2021,86 min,"Animation, Adventure, Comedy",Cal Brunker,"Billy Frolick, Cal Brunker, Bob Barlen","Tyler Perry, Ron Pardo, Will Brisbin",Ryder and the pups are called to Adventure City to stop Mayor Humdinger from turning the bustling metropolis into a state of chaos.,English,https://m.media-amazon.com/images/M/MV5BNzY2OTYwNjItYzczMC00YjYzLThmY2MtZGFhNmVmMzUzN2QyXkEyXkFqcGdeQXVyNjY1MTg4Mzc@._V1_SX300.jpg,50,6.2,"$29,879,041",N/A
213,The Addams Family 2,2021,PG,01 Oct 2021,93 min,"Animation, Adventure, Comedy","Greg Tiernan, Conrad Vernon, Laura Brousseau","Dan Hernandez, Benji Samit, Ben Queen","Oscar Isaac, Charlize Theron, Chloë Grace Moretz","The Addams get tangled up in more wacky adventures and find themselves involved in hilarious run-ins with all sorts of unsuspecting characters. Sequel to the 2019 animated film, 'The Addams Family'.","English, Spanish, Latin",https://m.media-amazon.com/images/M/MV5BNzQ5NzJjMDgtNzhjMC00NTQ2LTgzOTUtZThiMWMwYmYwMGYxXkEyXkFqcGdeQXVyMTkxNjUyNQ@@._V1_SX300.jpg,38,5.3,"$28,264,325",N/A
214,In the Heights,2021,PG-13,11 Jun 2021,143 min,"Drama, Music, Musical",Jon M. Chu,"Quiara Alegría Hudes, Lin-Manuel Miranda","Anthony Ramos, Corey Hawkins, Leslie Grace","A film version of the Broadway musical in which Usnavi, a sympathetic New York bodega owner, saves every penny every day as he imagines and sings about a better life.","English, Spanish",https://m.media-amazon.com/images/M/MV5BMzM1ZDY0YTktZTYzZi00MjZjLTllMDMtMmNlMmM5NmY4ZjllXkEyXkFqcGdeQXVyMTA1OTcyNDQ4._V1_SX300.jpg,84,7.4,"$27,466,489",N/A
215,Snake Eyes: G.I. Joe Origins,2021,PG-13,23 Jul 2021,121 min,"Action, Adventure, Fantasy",Robert Schwentke,"Evan Spiliotopoulos, Joe Shrapnel, Anna Waterhouse","Henry Golding, Andrew Koji, Haruka Abe",A G.I. Joe spin-off centered around the character of Snake Eyes.,English,https://m.media-amazon.com/images/M/MV5BNGJmMWUwMDgtYjEyNS00YmZhLTk3ZGEtZDliZDBhMDJkMGUyXkEyXkFqcGdeQXVyMDM2NDM2MQ@@._V1_SX300.jpg,43,5.4,"$27,268,035",N/A
216,Wrath of Man,2021,R,07 May 2021,119 min,"Action, Crime, Thriller",Guy Ritchie,"Nicolas Boukhrief, Éric Besnard, Guy Ritchie","Jason Statham, Holt McCallany, Josh Hartnett","The plot follows H, a cold and mysterious character working at a cash truck company responsible for moving hundreds of millions of dollars around Los Angeles each week.",English,https://m.media-amazon.com/images/M/MV5BNGVkOTlhOTktNjZiNS00NDg3LWIxMDAtZTY5Y2E0YjllN2IxXkEyXkFqcGdeQXVyMTkxNjUyNQ@@._V1_SX300.jpg,57,7.2,"$25,188,958","Shaken Not Stirred, Original Film, Moonlighting Films, Columbia Pictures"
217,Nobody,2021,R,26 Mar 2021,92 min,"Action, Crime, Drama",Ilya Naishuller,Derek Kolstad,"Bob Odenkirk, Aleksey Serebryakov, Connie Nielsen",A bystander who intervenes to help a woman being harassed by a group of men becomes the target of a vengeful drug lord.,"English, Russian, Spanish",https://m.media-amazon.com/images/M/MV5BMjM5YTRlZmUtZGVmYi00ZjE2LWIyNzAtOWVhMDk1MDdkYzhjXkEyXkFqcGdeQXVyMjMxOTE0ODA@._V1_SX300.jpg,64,7.4,"$23,100,000",N/A
218,Escape Room: Tournament of Champions,2021,PG-13,16 Jul 2021,88 min,"Action, Adventure, Horror",Adam Robitel,"Will Honley, Maria Melnik, Daniel Tuch","Taylor Russell, Logan Miller, Deborah Ann Woll","Six people unwillingly find themselves locked in another series of escape rooms, slowly uncovering what they have in common to survive. Joining forces with two of the original survivors, they soon discover they've all played the game",English,https://m.media-amazon.com/images/M/MV5BMzUxNGIyY2MtNDUxZC00YWY1LTg0MzctM2ExNTNmODlhMTRlXkEyXkFqcGdeQXVyMTE4Nzk0MzE4._V1_SX300.jpg,48,5.8,"$3,072","ArieScope Pictures, Coattails Entertainment"
219,Respect,2021,PG-13,13 Aug 2021,145 min,"Biography, Drama, Music",Liesl Tommy,"Tracey Scott Wilson, Callie Khouri","Jennifer Hudson, Forest Whitaker, Marlon Wayans","Following the rise of Aretha Franklin's career from a child singing in her father's church's choir to her international superstardom, RESPECT is the remarkable true story of the music icon's journey to find her voice.",English,https://m.media-amazon.com/images/M/MV5BZWQxODE4MWQtMTZlMi00N2UwLWEzNGEtOGVkZWVmMzgwYTg5XkEyXkFqcGdeQXVyODk2NDQ3MTA@._V1_SX300.jpg,62,6.6,"$17,635,215",N/A
220,Spiral,2007,PG-13,27 Jan 2007,90 min,"Drama, Thriller","Adam Green, Joel David Moore","Jeremy Danial Boreing, Joel David Moore","Joel David Moore, Amber Tamblyn, Zachary Levi","A recluse telemarkets at an office, where his boss is his only friend. As he befriends a new, social colleague and sketches/paints her, his dark mind surfaces.",English,https://m.media-amazon.com/images/M/MV5BNTA4MzA3YmEtZmU2Yy00OTdhLThhMWQtNjgzYjE1MTVlYTgxXkEyXkFqcGdeQXVyMTQxNzMzNDI@._V1_SX300.jpg,40,6.4,"$17,173,321",N/A
221,Spirit Untamed,2021,PG,04 Jun 2021,88 min,"Animation, Adventure, Comedy","Elaine Bogan, Ennio Torresan","Aury Wallington, Kristin Hahn, Katherine Nolfi","Isabela Merced, Marsai Martin, Mckenna Grace",Lucky Prescott's life is changed forever when she moves from her home in the city to a small frontier town and befriends a wild mustang named Spirit.,English,https://m.media-amazon.com/images/M/MV5BMDVlZTEwMTItNmE4Zi00ZGFhLWI4NjgtMDdiZTA5NDdmNWYyXkEyXkFqcGdeQXVyMTEyMjM2NDc2._V1_SX300.jpg,49,5.4,"$15,566,093",N/A
222,The Green Knight,2021,R,30 Jul 2021,130 min,"Adventure, Drama, Fantasy",David Lowery,David Lowery,"Dev Patel, Alicia Vikander, Joel Edgerton",A fantasy retelling of the medieval story of Sir Gawain and the Green Knight.,English,https://m.media-amazon.com/images/M/MV5BMjMxNTdiNWMtOWY0My00MjM4LTkwNzMtOGI0YThhN2Q4M2I4XkEyXkFqcGdeQXVyMTkxNjUyNQ@@._V1_SX300.jpg,85,6.7,"$15,530,440",N/A
223,The Marksman,2021,PG-13,15 Jan 2021,108 min,"Action, Drama, Thriller",Robert Lorenz,"Chris Charles, Danny Kravitz, Robert Lorenz","Katheryn Winnick, Liam Neeson, Teresa Ruiz",A rancher on the Arizona border becomes the unlikely defender of a young Mexican boy desperately fleeing the cartel assassins who've pursued him into the U.S.,"English, Spanish",https://m.media-amazon.com/images/M/MV5BODdlNThhMTUtNmU1OS00ZjM3LWE1ZjMtOWViN2RhYWRiZTg5XkEyXkFqcGdeQXVyMDA4NzMyOA@@._V1_SX300.jpg,44,5.6,"$15,244,012",N/A
224,The Unholy,2021,PG-13,02 Apr 2021,99 min,"Drama, Horror, Mystery",Evan Spiliotopoulos,"Evan Spiliotopoulos, James Herbert","Jeffrey Dean Morgan, Cricket Brown, William Sadler","A hearing-impaired girl is visited by the Virgin Mary and can suddenly hear, speak, and heal the sick. As people flock to witness her miracles, terrifying events unfold. Are they the work of the Virgin Mary or something much more sin","English, American Sign , Latin",https://m.media-amazon.com/images/M/MV5BYzljZGEyNjYtM2Q0NC00NWFlLWE3NDktYmZjNjg0NDFlNDc4XkEyXkFqcGdeQXVyNDU5MTU4ODU@._V1_SX300.jpg,36,5.1,"$14,435,950",N/A
225,The Little Things,2021,R,29 Jan 2021,128 min,"Crime, Drama, Mystery",John Lee Hancock,John Lee Hancock,"Denzel Washington, Rami Malek, Jared Leto","Kern County Deputy Sheriff Joe Deacon is sent to Los Angeles for what should have been a quick evidence-gathering assignment. Instead, he becomes embroiled in the search for a serial killer who is terrorizing the city.",English,https://m.media-amazon.com/images/M/MV5BOGFlNTdmYWQtM2IzMi00YTY3LTlmMDQtZDI5NGQ5MjYzZmEwXkEyXkFqcGdeQXVyNjY1MTg4Mzc@._V1_SX300.jpg,54,6.3,"$13,719,645",N/A
226,Stillwater,2021,R,30 Jul 2021,139 min,"Crime, Drama, Thriller",Tom McCarthy,"Tom McCarthy, Marcus Hinchey, Thomas Bidegain","Matt Damon, Camille Cottin, Abigail Breslin","A father travels from Oklahoma to France to help his estranged daughter, who is in prison for a murder she claims she didn't commit.","English, French",https://m.media-amazon.com/images/M/MV5BN2IzMTUyMDUtZGJmZC00YWMzLWFhMGMtZjQwMTkzMzViMjFkXkEyXkFqcGdeQXVyMTEyMjM2NDc2._V1_SX300.jpg,60,6.9,"$9,803,527",N/A
227,Dear Evan Hansen,2021,PG-13,24 Sep 2021,137 min,"Drama, Musical",Stephen Chbosky,"Steven Levenson, Justin Paul, Benj Pasek","Ben Platt, Julianne Moore, Kaitlyn Dever","Film adaptation of the Tony and Grammy Award-winning musical about Evan Hansen, a high school senior with Social Anxiety disorder and his journey of self-discovery and acceptance following the suicide of a fellow classmate.",English,https://m.media-amazon.com/images/M/MV5BYzMwZTZhY2UtNWRjYy00MDc3LWE2MWUtZTg5NjVmZGY1NTdhXkEyXkFqcGdeQXVyMTEyMjM2NDc2._V1_SX300.jpg,40,6.1,"$13,287,908",N/A
228,Malignant,2021,R,10 Sep 2021,111 min,"Crime, Horror, Mystery",James Wan,"James Wan, Ingrid Bisu, Akela Cooper","Annabelle Wallis, Maddie Hasson, George Young","Madison is paralyzed by shocking visions of grisly murders, and her torment worsens as she discovers that these waking dreams are in fact terrifying realities.",English,https://m.media-amazon.com/images/M/MV5BYTc0NWIwOTYtNzEwYi00YmUyLTlmYWYtYjJiZjRjN2RjMjAxXkEyXkFqcGdeQXVyMTEyMjM2NDc2._V1_SX300.jpg,50,6.3,"$8,342,538",N/A
229,Chaos Walking,2021,PG-13,05 Mar 2021,109 min,"Action, Adventure, Fantasy",Doug Liman,"Patrick Ness, Christopher Ford","Tom Holland, Daisy Ridley, Demián Bichir",Two unlikely companions embark on a perilous adventure through the badlands of an unexplored planet as they try to escape a dangerous and disorienting reality where all thoughts are seen and heard by everyone.,English,https://m.media-amazon.com/images/M/MV5BYTcxYTk3MWQtZThlMS00ZjQ0LTg0NjktNGVkNWM2MTAyYWJmXkEyXkFqcGdeQXVyMTEyMjM2NDc2._V1_SX300.jpg,38,5.7,"$7,446,823",N/A
230,Cry Macho,2021,PG-13,17 Sep 2021,104 min,"Drama, Thriller, Western",Clint Eastwood,"Nick Schenk, N. Richard Nash","Clint Eastwood, Dwight Yoakam, Daniel V. Graulau","A one-time rodeo star and washed-up horse breeder takes a job to bring a man's young son home and away from his alcoholic mom. On their journey, the horseman finds redemption through teaching the boy what it means to be a good man.","English, Spanish",https://m.media-amazon.com/images/M/MV5BOGQ5OTBkNzAtYWQxYy00YjIxLWJkNTAtNTM2NDMxYzdkZDVmXkEyXkFqcGdeQXVyMTEyMjM2NDc2._V1_SX300.jpg,60,5.9,N/A,N/A
231,The Protégé,2021,R,20 Aug 2021,109 min,"Action, Crime, Thriller",Martin Campbell,Richard Wenk,"Maggie Q, Samuel L. Jackson, Michael Keaton","Rescued as a child by the legendary assassin Moody, Anna is the world's most skilled contract killer. However, when Moody is brutally killed, she vows revenge for the man who taught her everything she knows.",English,https://m.media-amazon.com/images/M/MV5BNGQ2MTQ3ZjQtZmRjMS00ZDJmLTlkYWQtOWVhODllYjJiNGUxXkEyXkFqcGdeQXVyODk4OTc3MTY@._V1_SX300.jpg,48,6.1,"$7,347,103","Bron Studios, Creative Wealth Media Finance, Film Rites"
232,The Many Saints of Newark,2021,R,01 Oct 2021,120 min,"Crime, Drama",Alan Taylor,"David Chase, Lawrence Konner","Alessandro Nivola, Leslie Odom Jr., Jon Bernthal",A look at the formative years of New Jersey gangster Tony Soprano.,English,https://m.media-amazon.com/images/M/MV5BYmQzNmY3YzItOTE3OC00NGZjLTkwZDYtOWVmM2QyMzhiYTgwXkEyXkFqcGdeQXVyMTkxNjUyNQ@@._V1_SX300.jpg,66,7.4,"$6,912,522",N/A
233,Those Who Wish Me Dead,2021,R,14 May 2021,100 min,"Action, Crime, Drama",Taylor Sheridan,"Michael Koryta, Charles Leavitt, Taylor Sheridan","Angelina Jolie, Nicholas Hoult, Finn Little",A teenage murder witness finds himself pursued by twin assassins in the Montana wilderness with a survival expert tasked with protecting him -- and a forest fire threatening to consume them all.,English,https://m.media-amazon.com/images/M/MV5BMDAxMmQ0NTAtNDllNC00ZjE2LTlkNjUtMmExNmY0MmNkMDQ0XkEyXkFqcGdeQXVyNzYyOTM1ODI@._V1_SX300.jpg,59,6.0,N/A,N/A
234,The Night House,2020,R,20 Aug 2021,107 min,"Horror, Mystery, Thriller",David Bruckner,"Ben Collins, Luke Piotrowski","Rebecca Hall, Sarah Goldberg, Vondie Curtis-Hall",A widow begins to uncover her recently deceased husband's disturbing secrets.,English,https://m.media-amazon.com/images/M/MV5BZmIwNjJhOGYtNDcyNi00Yjc4LThiNTktMDM2ZjFhM2YxMTljXkEyXkFqcGdeQXVyODk4OTc3MTY@._V1_SX300.jpg,68,6.9,"$5,446,607",N/A
235,Ironbark Bill in 'The Champion Buckjumper',1986,N/A,30 Apr 1986,8 min,"Animation, Short, Family, Fantasy",Philip Pepper,Lisa Noonan,John Clarke,"Ironbark Bill's horse is a champion jumper, jumping so high he ends up stuck up in the clouds. Ironbark Bill has to go and rescue him.",English,N/A,N/A,N/A,"$5,249,970",N/A
236,Judas and the Black Messiah,2021,R,12 Feb 2021,126 min,"Biography, Drama, History",Shaka King,"Will Berson, Shaka King, Kenneth Lucas","Daniel Kaluuya, LaKeith Stanfield, Jesse Plemons","Offered a plea deal by the FBI, William O'Neal infiltrates the Illinois chapter of the Black Panther Party to gather intelligence on Chairman Fred Hampton.",English,https://m.media-amazon.com/images/M/MV5BMjBjYjBjNTUtOTg0Ni00Yzk2LTg1NWMtNjI2ODk2YjJmZGU0XkEyXkFqcGdeQXVyODE5NzE3OTE@._V1_SX300.jpg,85,7.5,"$2,310,000",N/A
237,Roadrunner: A Film About Anthony Bourdain,2021,R,16 Jul 2021,119 min,Documentary,Morgan Neville,N/A,"Anthony Bourdain, Ottavia Bourdain, David Chang","A documentary about Anthony Bourdain and his career as a chef, writer and host, revered and renowned for his authentic approach to food, culture and travel.",English,https://m.media-amazon.com/images/M/MV5BYmUwMjlhYTktNWE4Zi00MDcwLWE1OTctMjAyMWU4NjVlYWM4XkEyXkFqcGdeQXVyMTAyMjQ3NzQ1._V1_SX300.jpg,N/A,7.8,"$4,844,399",N/A
238,Copshop,2021,R,17 Sep 2021,107 min,"Action, Crime, Thriller",Joe Carnahan,"Kurt McLeod, Joe Carnahan, Mark Williams","Frank Grillo, Gerard Butler, Toby Huss","On the run from a lethal assassin, a wily con artist devises a scheme to hide out inside a small-town police station-but when the hitman turns up at the precinct, an unsuspecting rookie cop finds herself caught in the crosshairs.",English,https://m.media-amazon.com/images/M/MV5BMTZjZWYzYjMtMmNlYi00MTdkLWI4OTMtMmVhM2QzZjZiZTZiXkEyXkFqcGdeQXVyNjY1MTg4Mzc@._V1_SX300.jpg,59,6.7,"$4,509,143",N/A
239,Zola,2020,R,30 Jun 2021,86 min,"Comedy, Crime, Drama",Janicza Bravo,"Janicza Bravo, Jeremy O. Harris, A'Ziah King","Taylour Paige, Riley Keough, Nicholas Braun",A stripper named Zola embarks on a wild road trip to Florida.,English,https://m.media-amazon.com/images/M/MV5BNjNjMWJhYTktZDk5Ny00OWM3LTlmYzYtYmEwMDM3NGYwNmUxXkEyXkFqcGdeQXVyMTkxNjUyNQ@@._V1_SX300.jpg,76,6.5,N/A,N/A
240,Separation,2021,R,30 Apr 2021,107 min,Horror,William Brent Bell,"Nick Amadeus, Josh Braun","Rupert Friend, Violet McGraw, Madeline Brewer",A young girl finds solace in her artist father and the ghost of her dead mother.,English,https://m.media-amazon.com/images/M/MV5BN2QxMjIxNDYtZGRiOS00MjdmLWI4YTItZDQ4YzI2ODFiODU3XkEyXkFqcGdeQXVyMDA4NzMyOA@@._V1_SX300.jpg,N/A,4.6,"$3,900,193",N/A
241,Boogie,2008,Not Rated,19 Sep 2008,103 min,"Comedy, Drama",Radu Muntean,"Alexandru Baciu, Radu Muntean, Razvan Radulescu","Dragos Bucur, Anamaria Marinca, Mimi Branescu","On his spring break at the seaside, with his wife and his four year old son, Bogdan Ciocazanu runs into his best friends from high-school at the precise date and time that reminds all of them of their most glorious drinking trips and",Romanian,https://m.media-amazon.com/images/M/MV5BMTkxNjkzMTA3NV5BMl5BanBnXkFtZTcwNjY0MjE3Mg@@._V1_SX300.jpg,N/A,7.1,"$3,679,849",N/A
242,Reminiscence,2021,PG-13,20 Aug 2021,116 min,"Mystery, Romance, Sci-Fi",Lisa Joy,Lisa Joy,"Hugh Jackman, Rebecca Ferguson, Thandiwe Newton","Nick Bannister, a private investigator of the mind, navigates the alluring world of the past when his life is changed by new client Mae. A simple case becomes an obsession after she disappears and he fights to learn the truth about h","English, Mandarin, Spanish",https://m.media-amazon.com/images/M/MV5BODBkMTNmMmQtYTNlMy00OTRhLWE5MzgtYTZlMTUyYzY1MzkzXkEyXkFqcGdeQXVyNjY1MTg4Mzc@._V1_SX300.jpg,46,5.9,"$3,186,668",N/A
243,12 Mighty Orphans,2021,PG-13,18 Jun 2021,118 min,"History, Sport",Ty Roberts,"Jim Dent, Ty Roberts, Lane Garrison","Luke Wilson, Vinessa Shaw, Wayne Knight","Haunted by his mysterious past, a devoted high school football coach leads a scrawny team of orphans to the state championship during the Great Depression and inspires a broken nation along the way.",English,https://m.media-amazon.com/images/M/MV5BZWMxNzA1NWEtYjgwMC00ZjkwLTljYjYtN2E3ZWIzODJlN2Y4XkEyXkFqcGdeQXVyOTgxNDIzMTY@._V1_SX300.jpg,44,6.9,"$3,163,362",N/A
244,Pig,2021,R,16 Jul 2021,92 min,"Drama, Thriller",Michael Sarnoski,"Vanessa Block, Michael Sarnoski","Nicolas Cage, Alex Wolff, Adam Arkin",A truffle hunter who lives alone in the Oregonian wilderness must return to his past in Portland in search of his beloved foraging pig after she is kidnapped.,English,https://m.media-amazon.com/images/M/MV5BOTc2NjRmN2QtMGY1Ny00MTc2LWJmMWUtZmViOTkyNjk2NGExXkEyXkFqcGdeQXVyNzg5MzIyOA@@._V1_SX300.jpg,82,7.0,"$3,149,935",N/A
245,The Girl Who Believes in Miracles,2021,PG,02 Apr 2021,100 min,"Drama, Family",Richard Correll,"Richard Correll, G.M. Mercier","Mira Sorvino, Austyn Johnson, Kevin Sorbo","When young Sara hears a preacher say faith can move mountains, she starts praying. Suddenly, people in her town are mysteriously healed - but fame soon takes its toll.",English,https://m.media-amazon.com/images/M/MV5BMzAzMTAxZGUtMGY0OS00MTk1LTlkMTMtMzNhYmRlZDVhNTA3XkEyXkFqcGdeQXVyMTQ3ODkwMjc@._V1_SX300.jpg,N/A,5.3,"$2,913,328",N/A
246,Voyagers,2021,PG-13,09 Apr 2021,108 min,"Adventure, Sci-Fi, Thriller",Neil Burger,Neil Burger,"Colin Farrell, Tye Sheridan, Lily-Rose Depp","A crew of astronauts on a multi-generational mission descend into paranoia and madness, not knowing what is real or not.",English,https://m.media-amazon.com/images/M/MV5BZDIzODQyODQtYzIyYy00MDE5LWJmZjMtMDRmYTRkNzAyZjAzXkEyXkFqcGdeQXVyMTEyMjM2NDc2._V1_SX300.jpg,44,5.4,"$2,807,494",N/A
247,Dream Horse,2020,PG,21 May 2021,113 min,"Biography, Comedy, Drama",Euros Lyn,Neil McKay,"Toni Collette, Owen Teale, Alan David","Dream Alliance is an unlikely race horse bred by small-town Welsh bartender Jan Vokes. With no experience, Jan convinces her neighbors to chip in their meager earnings to help raise Dream in the hopes he can compete with the racing e",English,https://m.media-amazon.com/images/M/MV5BOTQ5MmRlYWItZmNiYS00ZmE5LTg4NjAtZjZjZjNjYTRhMDY1XkEyXkFqcGdeQXVyMDM2NDM2MQ@@._V1_SX300.jpg,68,6.9,"$2,753,985","Red Sky Studios, Nook Lane Entertainment, MK1 Productions"
248,Here Today,2021,PG-13,07 May 2021,117 min,"Comedy, Drama",Billy Crystal,"Alan Zweibel, Billy Crystal","Billy Crystal, Chad Jennings, Dierdre Friel","When veteran comedy writer Charlie Burnz meets New York street singer Emma Payge, they form an unlikely yet hilarious and touching friendship that kicks the generation gap aside and redefines the meaning of love and trust.",English,https://m.media-amazon.com/images/M/MV5BODdjZGY0NzgtZjZjMS00NTQ2LWI4ZDYtNmY5MTk0MmY3ZDQ4XkEyXkFqcGdeQXVyMTA3MzQ4MTg0._V1_SX300.jpg,40,6.5,"$2,657,850",N/A
249,Finding You,2021,PG,14 May 2021,119 min,"Drama, Romance",Brian Baugh,"Jenny B. Jones, Brian Baugh","Rose Reid, Jedidiah Goodacre, Katherine McNamara",Violinist Finley Sinclair travels to an Irish coastal village to begin her semester studying abroad. At the B&amp;B run by her host family she encounters the gregarious and persistent heartthrob movie star Beckett Rush.,English,https://m.media-amazon.com/images/M/MV5BNzk3ZWRiMjMtYWNhZS00N2U0LWI2YTYtMDliMzU5ZWZjZWFmXkEyXkFqcGdeQXVyMDM2NDM2MQ@@._V1_SX300.jpg,41,6.1,"$2,577,830",N/A
250,The Card Counter,2021,R,10 Sep 2021,111 min,"Action, Crime, Drama",Paul Schrader,Paul Schrader,"Oscar Isaac, Tiffany Haddish, Tye Sheridan","Redemption is the long game in Paul Schrader's THE CARD COUNTER. Told with Schrader's trademark cinematic intensity, the revenge thriller tells the story of an ex-military interrogator turned gambler haunted by the ghosts of his past",English,https://m.media-amazon.com/images/M/MV5BNTMyNzQ4MmUtMmJiYy00YjlmLWJiMzktNjc1MGNlMzBjYjhiXkEyXkFqcGdeQXVyMDA4NzMyOA@@._V1_SX300.jpg,78,N/A,"$1,029,591",N/A
251,Land,2021,PG-13,12 Feb 2021,89 min,"Adventure, Drama",Robin Wright,"Jesse Chatham, Erin Dignam","Robin Wright, Demián Bichir, Sarah Dawn Pledge","A bereaved woman seeks out a new life, off the grid in Wyoming.",English,https://m.media-amazon.com/images/M/MV5BMDk4YmZiZjYtMjgxMi00ZWU4LTk5MTQtMTBjOTZiOGUxOTM2XkEyXkFqcGdeQXVyODk4OTc3MTY@._V1_SX300.jpg,61,6.6,"$2,320,649",N/A
252,The Eyes of Tammy Faye,2000,PG-13,01 Oct 2000,79 min,"Documentary, Biography","Fenton Bailey, Randy Barbato",N/A,"RuPaul, Tammy Faye Bakker, Virginia Fairchild","Twelve years after the dramatic collapse of the Christian empire of Jim and Tammy Faye Bakker, this documentary tells for the first time what really happened when they lost control of the first and most successful TV ministry of its ",English,https://m.media-amazon.com/images/M/MV5BOGY2OTg4OGUtZDU3ZC00YWJjLWExNjctNzBiMzJkMWY0N2UxXkEyXkFqcGdeQXVyMTQ4NDY5OTc@._V1_SX300.jpg,69,7.2,"$2,143,000",N/A
253,"Summer of Soul (...Or, When the Revolution Could Not Be Televised)",2021,PG-13,02 Jul 2021,118 min,"Documentary, Music",Questlove,N/A,"Roy Ayers, Ethel Beatty, Barbara Bland-Acosta","Summer Of Soul (...Or, When The Revolution Could Not Be Televised) is a feature documentary about the legendary 1969 Harlem Cultural Festival which celebrated African American music and culture, and promoted Black pride and unity.",English,https://m.media-amazon.com/images/M/MV5BNDE0MDRkODUtMTEwMC00ZWE2LWEyNzgtYzM5ZmVkZGMwMDg4XkEyXkFqcGdeQXVyMTkxNjUyNQ@@._V1_SX300.jpg,96,8.2,"$2,122,771",N/A
254,Nomadland,2020,R,19 Feb 2021,107 min,Drama,Chloé Zhao,"Chloé Zhao, Jessica Bruder","Frances McDormand, David Strathairn, Linda May","A woman in her sixties, after losing everything in the Great Recession, embarks on a journey through the American West, living as a van-dwelling modern-day nomad.",English,https://m.media-amazon.com/images/M/MV5BMDRiZWUxNmItNDU5Yy00ODNmLTk0M2ItZjQzZTA5OTJkZjkyXkEyXkFqcGdeQXVyMTkxNjUyNQ@@._V1_SX300.jpg,93,7.4,"$1,926,706",N/A
255,The Father,2020,PG-13,26 Feb 2021,97 min,Drama,Florian Zeller,"Christopher Hampton, Florian Zeller","Anthony Hopkins, Olivia Colman, Mark Gatiss","A man refuses all assistance from his daughter as he ages. As he tries to make sense of his changing circumstances, he begins to doubt his loved ones, his own mind and even the fabric of his reality.",English,https://m.media-amazon.com/images/M/MV5BZGJhNWRiOWQtMjI4OS00ZjcxLTgwMTAtMzQ2ODkxY2JkOTVlXkEyXkFqcGdeQXVyMTkxNjUyNQ@@._V1_SX300.jpg,88,8.3,"$1,380,902",N/A
256,Queen Bees,2021,PG-13,11 Jun 2021,100 min,"Comedy, Drama, Romance",Michael Lembeck,"Donald Martin, Harrison Powell","Ellen Burstyn, Jane Curtin, Loretta Devine","After reluctantly agreeing to move in to a senior's home, a woman encounters a clique of mean-spirited women and an amorous widower.",English,https://m.media-amazon.com/images/M/MV5BZDNiYTEyNWEtMDUwNy00Njg0LTg0YjQtMmIzNTkwZTkwY2Q0XkEyXkFqcGdeQXVyMDA4NzMyOA@@._V1_SX300.jpg,52,5.9,"$1,744,740","Bazelevs Entertainment, TABBAK"
257,Show Me the Father,2021,PG,10 Sep 2021,91 min,"Documentary, Drama",Rick Altizer,N/A,"Jim Daly, Jonathan Evans, Tony Evans",Features captivating stories interwoven with inspirational truths about the fatherhood of God.,English,https://m.media-amazon.com/images/M/MV5BZWJjZWRmZjQtNzQ0Ny00NzY4LTg4MGMtMmU1NTBiZmUzNTUyXkEyXkFqcGdeQXVyMjQ4NTQ5OTY@._V1_SX300.jpg,N/A,6.2,"$1,437,938",N/A
258,Profile,2018,R,14 May 2021,106 min,"Mystery, Thriller",Timur Bekmambetov,"Britt Poulton, Timur Bekmambetov, Olga Kharina","Valene Kane, Morgan Watkins, Christine Adams","An undercover British journalist infiltrates the online propaganda channels of the so-called Islamic State, only to be sucked in by her recruiter.","English, Arabic",https://m.media-amazon.com/images/M/MV5BMjRkYTkyMTQtOGE1NC00NDMxLWJlNzQtYTg3NWJhMzdjYTk0XkEyXkFqcGdeQXVyODk4OTc3MTY@._V1_SX300.jpg,54,6.8,"$1,405,488",N/A
259,Together Together,2021,R,23 Apr 2021,90 min,Comedy,Nikole Beckwith,Nikole Beckwith,"Patti Harrison, Ed Helms, Rosalind Chao","When a young loner becomes the gestational surrogate for a single man in his 40s, the two strangers come to realize this unexpected relationship will challenge their perceptions of connection, boundaries and the particulars of love.",English,https://m.media-amazon.com/images/M/MV5BYTI5MmQ0M2UtMjZkZC00Mjk1LTljZmItN2ZlYzQ3MDdkZTQ3XkEyXkFqcGdeQXVyMTEyMjM2NDc2._V1_SX300.jpg,70,6.5,"$15,418,790",N/A
260,Good Joe Bell,2020,R,23 Jul 2021,94 min,"Biography, Drama",Reinaldo Marcus Green,"Diana Ossana, Larry McMurtry","Mark Wahlberg, Reid Miller, Connie Britton","The true story of a small town, working class father who embarks on a solo walk across the U.S. to crusade against bullying after his son is tormented in high school for being gay.",English,https://m.media-amazon.com/images/M/MV5BZGM2MDQ4OTUtNjI3Mi00OTNiLWJhYmYtOTdiN2JiYTNmN2Q0XkEyXkFqcGdeQXVyMTkxNjUyNQ@@._V1_SX300.jpg,54,5.5,"$14,547",N/A
261,Wrong Turn,2003,R,30 May 2003,84 min,"Horror, Thriller",Rob Schmidt,Alan B. McElroy,"Eliza Dushku, Jeremy Sisto, Emmanuelle Chriqui","Chris and a group of five friends are left stranded deep in the middle of the woods after their cars collide. As they venture deeper into the woods, they face an uncertain and bloodcurdling fate.",English,https://m.media-amazon.com/images/M/MV5BMTQwMTkyMTY4M15BMl5BanBnXkFtZTYwMDc0NDE3._V1_SX300.jpg,32,6.1,"$1,113,723",N/A
