,Title,Year,Rated,Released,Runtime,Genre,Director,Writer,Actors,Plot,Language,Poster,Metascore,imdbRating,BoxOffice,Production
262,Lamb,2015,R,12 Jan 2016,97 min,Drama,Ross Partridge,"Bonnie Nadzam, Ross Partridge","Ross Partridge, Oona Laurence, Jess Weixler",When a man meets a young girl in a parking lot he attempts to help her avoid a bleak destiny by initiating her into the beauty of the outside world. The journey shakes them in ways neither expects.,English,https://m.media-amazon.com/images/M/MV5BNmYwMWYzNzktZjJkNi00N2JkLThkOWItMTE4NDVjYjc5ZTY4XkEyXkFqcGdeQXVyMTY5Nzc4MDY@._V1_SX300.jpg,62,6.3,N/A,N/A
263,In the Earth,2021,R,16 Apr 2021,107 min,"Horror, Sci-Fi, Thriller",Ben Wheatley,Ben Wheatley,"Joel Fry, Reece Shearsmith, Hayley Squires","As the world searches for a cure to a disastrous virus, a scientist and park scout venture deep in the forest for a routine equipment run.",English,https://m.media-amazon.com/images/M/MV5BMWU0NjMxZGMtMjg5OC00Y2RiLThiMmEtYzYzMmFiNTgyMjM5XkEyXkFqcGdeQXVyMTkxNjUyNQ@@._V1_SX300.jpg,63,5.2,"$684,508",N/A
264,Titane,2021,R,01 Oct 2021,108 min,"Drama, Sci-Fi, Thriller",Julia Ducournau,"Jacques Akchoti, Jean-Christophe Bouzy, Julia Ducournau","Vincent Lindon, Agathe Rousselle, Garance Marillier","Following a series of unexplained crimes, a father is reunited with the son who has been missing for 10 years. Titane : A metal highly resistant to heat and corrosion, with high tensile strength alloys.",French,https://m.media-amazon.com/images/M/MV5BNGJlMTVlYWQtYmM5OC00MDgwLTk3NzAtMGViY2VjOGU0YjlkXkEyXkFqcGdeQXVyMTkxNjUyNQ@@._V1_SX300.jpg,75,6.6,"$888,768",N/A
265,Un rescate de huevitos,2021,PG,12 Aug 2021,88 min,"Animation, Adventure, Comedy","Gabriel Riva Palacio Alatriste, Rodolfo Riva Palacio Alatriste","Eduardo M. Clorio, Iñaki Otero, Gabriel Riva Palacio Alatriste","Marcelo Barcelo, Mauricio Barrientos, Bruno Bichir",Toto and his friends must rescue his egg children after they're taken away for a gourmet food event in Africa.,Spanish,https://m.media-amazon.com/images/M/MV5BNTA2OWFmNDktMGE0OS00Yzg2LTkzODQtNTE3YjNhYTA3YTkzXkEyXkFqcGdeQXVyMTAxNjU3ODY0._V1_SX300.jpg,N/A,6.2,N/A,N/A
266,The Jesus Music,2021,PG-13,01 Oct 2021,109 min,Documentary,"Andrew Erwin, Jon Erwin",Jon Erwin,"Kirk Franklin, Amy Grant, Kevin Max","This documentary reveals Jesus Music's untold story - from its humble beginnings at the Calvary Chapel in Costa Mesa, California through its transformation into the multi-billion-dollar industry of Christian Contemporary Music today.",English,https://m.media-amazon.com/images/M/MV5BOWU1YmI1ZmEtNjUxZC00N2E5LTg1YTItNDBjYmUyZWYxMTY4XkEyXkFqcGdeQXVyMDM2NDM2MQ@@._V1_SX300.jpg,42,7.5,"$837,849",N/A
267,Witnesses,2019,N/A,09 Sep 2019,97 min,"Crime, Horror, Thriller",Christopher Burgart,Christopher Burgart,"Jesse Howland, Conner Floyd, Rachel Clark-Spear",Four college classmates are hunted by a ruthless drug cartel hitman when they inadvertently record a murder while shooting their student film.,"English, Spanish",https://m.media-amazon.com/images/M/MV5BZWMxYTIxYWUtNDFlYS00YjliLTg5NjktNjM3NmMwYzM5MGFiXkEyXkFqcGdeQXVyNTk3MjkwMDM@._V1_SX300.jpg,N/A,4.8,"$836,536",N/A
268,Four Good Days,2020,R,21 May 2021,100 min,Drama,Rodrigo García,"Eli Saslow, Rodrigo García, Amanda Wendler","Glenn Close, Mila Kunis, Stephen Root",A mother helps her daughter work through four crucial days of recovery from substance abuse.,English,https://m.media-amazon.com/images/M/MV5BZDBhMDJkYjItODFlNi00NjMzLWE3MmQtZmUwNGQzMWE4NjMxXkEyXkFqcGdeQXVyNjY1MTg4Mzc@._V1_SX300.jpg,52,6.6,"$708,122",N/A
269,The Mauritanian,2021,R,02 Mar 2021,129 min,"Drama, Thriller",Kevin Macdonald,"Michael Bronner, Rory Haines, Sohrab Noshirvani","Tahar Rahim, Nouhe Hamady Bari, Saadna Hamoud",Mohamedou Ould Slahi fights for freedom after being detained and imprisoned without charge by the U.S. Government for years.,"English, French, Arabic, German",https://m.media-amazon.com/images/M/MV5BODJlMzdlYzItMzRkNi00NTE0LTliZjQtMTllNzkxNDVhNjkxXkEyXkFqcGdeQXVyNjY1MTg4Mzc@._V1_SX300.jpg,53,7.5,"$744,813",N/A
270,The Alpinist,2021,PG-13,10 Sep 2021,92 min,Documentary,"Peter Mortimer, Nick Rosen",N/A,"Marc-André Leclerc, Brette Harrington, Peter Mortimer","Marc-André Leclerc climbs alone, far from the limelight. The free-spirited 23-year-old makes some of the boldest solo ascents in history. With no cameras and no margin for error, Leclerc's approach is the essence of solo adventure.",English,https://m.media-amazon.com/images/M/MV5BOWY1NTBmOTQtYzgxMi00NjU0LTliNGEtNmUwNmQzZGVjNzhkXkEyXkFqcGdeQXVyMTA3MDk2NDg2._V1_SX300.jpg,66,7.8,"$741,895",N/A
271,Lamb of God: The Concert Film,2021,N/A,12 Mar 2021,90 min,Musical,Rob Gardner,Rob Gardner,"Casey Elliott, Katherine Thomas, Tyler Hardwick","Embrace the hope of Easter and experience the power of the last week of Christ's mortal ministry as told through the internationally acclaimed musical event, Lamb of God. This unique concert film brings award winning composer Rob Gar",English,https://m.media-amazon.com/images/M/MV5BOGE5Njc0MzEtZGY1Zi00ZWViLTkwNmYtOTFmOGMzYzA1OTdkXkEyXkFqcGdeQXVyNzc0MTgzMzU@._V1_SX300.jpg,N/A,8.4,N/A,N/A
272,French Exit,2020,R,12 Feb 2021,113 min,"Comedy, Drama",Azazel Jacobs,Patrick DeWitt,"Michelle Pfeiffer, Lucas Hedges, Tracy Letts",An aging Manhattan socialite living on what's barely left of her inheritance moves to a small apartment in Paris with her son and cat.,English,https://m.media-amazon.com/images/M/MV5BNjAyMTY0NmMtZDU0Zi00NzhlLWJmM2ItZGVhYjA5MDE3MzI5XkEyXkFqcGdeQXVyOTgxNDIzMTY@._V1_SX300.jpg,56,6.0,"$682,677",N/A
273,Blue Bayou,2021,R,17 Sep 2021,112 min,Drama,Justin Chon,Justin Chon,"Justin Chon, Alicia Vikander, Mark O'Brien","As a Korean-American man raised in the Louisiana bayou works hard to make a life for his family, he must confront the ghosts of his past as he discovers that he could be deported from the only country he has ever called home.",English,https://m.media-amazon.com/images/M/MV5BZjkyNjY1ZDAtMDBmNC00NzU1LTk1MzMtZTc5OWY3ODMwZWIzXkEyXkFqcGdeQXVyMTkxNjUyNQ@@._V1_SX300.jpg,60,6.4,"$663,725",N/A
274,Nine Days,2020,R,30 Jul 2021,124 min,"Drama, Fantasy",Edson Oda,Edson Oda,"Winston Duke, Zazie Beetz, Benedict Wong",A reclusive man conducts a series of interviews with human souls for a chance to be born.,English,https://m.media-amazon.com/images/M/MV5BNGUzOTQwZDUtZjkxOS00YjNmLThmMWYtZjA3Y2M4MmU4Mjg0XkEyXkFqcGdeQXVyMTkxNjUyNQ@@._V1_SX300.jpg,73,7.6,"$637,665","Complete Fiction, Media Rights Capital"
275,Our Friend,2019,R,29 Jan 2021,124 min,"Drama, Romance",Gabriela Cowperthwaite,"Brad Ingelsby, Matthew Teague","Jason Segel, Isabella Kai, Violet McGraw","After receiving life-altering news, a couple finds unexpected support from their best friend, who puts his own life on hold and moves into their family home, bringing an impact much greater and more profound than anyone could have im",English,https://m.media-amazon.com/images/M/MV5BZjQxOTY2MzYtZjhhNy00Y2ExLWJiMWYtYTNkMzA2ZTk5MDU4XkEyXkFqcGdeQXVyNTU5Mzk0NjE@._V1_SX300.jpg,57,7.3,"$575,783",N/A
276,The Sparks Brothers,2021,R,18 Jun 2021,140 min,"Documentary, Music",Edgar Wright,N/A,"Ron Mael, Russell Mael, Beck",A musical odyssey through five weird and wonderful decades with Ron and Russell Mael celebrating the inspiring legacy of Sparks.,English,https://m.media-amazon.com/images/M/MV5BNTA0YTE5M2MtZTc0Ny00ODViLWI2ZjItOTU3YzJmNzdhYjI3XkEyXkFqcGdeQXVyNTI4MzE4MDU@._V1_SX300.jpg,80,7.9,"$572,493",N/A
277,Werewolves Within,2021,R,02 Jul 2021,97 min,"Comedy, Horror",Josh Ruben,Mishna Wolff,"Sam Richardson, Milana Vayntrub, George Basil",Feature adaptation of the video game where werewolves attack a small town.,English,https://m.media-amazon.com/images/M/MV5BZDlkZmY3ZGUtMjY3ZS00MGE4LWFjMjYtZjNmYTE0YWYxOTJmXkEyXkFqcGdeQXVyODk4OTc3MTY@._V1_SX300.jpg,66,6.0,N/A,Arclight Films
278,City of Lies,2018,R,19 Mar 2021,112 min,"Biography, Crime, Drama",Brad Furman,"Randall Sullivan, Christian Contreras","Johnny Depp, Forest Whitaker, Toby Huss",Russell Poole and Jack Jackson investigate the murders of rappers Notorious B.I.G. and Tupac Shakur.,"English, Spanish",https://m.media-amazon.com/images/M/MV5BY2YyNTJjYmMtOGQxZC00N2UxLWEzNjMtOGU3ZjA2MGU1NjA5XkEyXkFqcGdeQXVyMTE1Nzg4NjY0._V1_SX300.jpg,44,6.5,"$521,202",N/A
279,Long Weekend,2008,R,04 Aug 2009,88 min,"Drama, Horror, Thriller",Jamie Blanks,Everett De Roche,"Jim Caviezel, Claudia Karvan, Star",A vacationing couple in the wilderness learns what happens when they disrespect nature.,English,https://m.media-amazon.com/images/M/MV5BNDQ0MGI0MWItMjljMC00ZGVkLTliYWYtNmEwOTAzZTVhNjU2XkEyXkFqcGdeQXVyMTQxNzMzNDI@._V1_SX300.jpg,N/A,5.1,"$470,000",N/A
280,The Truffle Hunters,2020,PG-13,12 Mar 2021,84 min,Documentary,"Michael Dweck, Gregory Kershaw","Michael Dweck, Gregory Kershaw","Piero Botto, Sergio Cauda, Maria Cicciù","Deep in the forests of Piedmont, Italy, a handful of men, seventy or eighty years old, hunt for the rare and expensive white Alba truffle-which to date has resisted all of modern science's efforts at cultivation.",Italian,https://m.media-amazon.com/images/M/MV5BNjBiN2QyZDQtZGJkZS00YjJlLThlNTctYTZlYjU4NzdmYjNkXkEyXkFqcGdeQXVyMTkxNjUyNQ@@._V1_SX300.jpg,84,7.2,"$300,327",N/A
281,Jathi Ratnalu,2021,N/A,11 Mar 2021,145 min,Comedy,Anudeep K.V.,Anudeep K.V.,"Naveen Polishetty, Rahul Ramakrishna, Priyadarshi",The plot revolves around the three prisoners. They get released and plan for a happy life outside. Things take a new turn and bring in a twist. Can they find happiness and love now?,Telugu,https://m.media-amazon.com/images/M/MV5BNTY5ZTcwOTEtNGU0MS00NWFkLWExZDUtMTljY2Y2YWMxNGNlXkEyXkFqcGdeQXVyMTI1NDAzMzM0._V1_SX300.jpg,N/A,7.6,"$423,602",N/A
282,The Lost Leonardo,2021,PG-13,13 Aug 2021,96 min,Documentary,Andreas Koefoed,"Andreas Dalsgaard, Christian Kirk Muff, Andreas Koefoed","Martin Kemp, Robert K. Wittman, Jerry Saltz","The mystery surrounding the Salvator Mundi, the first painting by Leonardo da Vinci to be discovered for more than a century, which has now seemingly gone missing.","English, French",https://m.media-amazon.com/images/M/MV5BMDdlZjFmNzItYzlmOS00YzMzLTgyZTgtNTQ3ZTdjNzQxN2QxXkEyXkFqcGdeQXVyOTgxNDIzMTY@._V1_SX300.jpg,79,7.6,"$418,286",N/A
283,Flag Day,2021,R,20 Aug 2021,109 min,"Drama, Thriller",Sean Penn,"Jez Butterworth, Jennifer Vogel","Mitchell McCormick, Tom Anniko, Dylan Penn","A father lives a double life as a counterfeiter, bank robber and con man in order to provide for his daughter.",English,https://m.media-amazon.com/images/M/MV5BZmVkYjZlZDItMDk4NS00ZjVjLTkyNjYtY2NiNzQ5ODE0ZWRlXkEyXkFqcGdeQXVyMDM2NDM2MQ@@._V1_SX300.jpg,54,4.6,N/A,N/A
284,Willy's Wonderland,2021,TV-MA,12 Feb 2021,88 min,"Action, Comedy, Horror",Kevin Lewis,G.O. Parsons,"Nicolas Cage, Emily Tosta, Beth Grant","A quiet drifter is tricked into a janitorial job at the now condemned Willy's Wonderland. The mundane tasks suddenly become an all-out fight for survival against wave after wave of demonic animatronics. Fists fly, kicks land, titans ",English,https://m.media-amazon.com/images/M/MV5BOTc3ZjVkYTYtMDZiMC00OTliLWE3OTEtYjY5NTBmNGJjYTBmXkEyXkFqcGdeQXVyNDExMzMxNjE@._V1_SX300.jpg,44,5.5,"$368,301",N/A
285,Dreamland,2019,R,17 Nov 2020,98 min,"Drama, Thriller",Miles Joris-Peyrafitte,Nicolaas Zwart,"Finn Cole, Margot Robbie, Travis Fimmel",A teenager's adventures as a bounty hunter take an unexpected twist.,English,https://m.media-amazon.com/images/M/MV5BZWIzMTgyYWUtOWJhMy00MTlhLWJlOWItYjdhY2FlNDY5MmE3XkEyXkFqcGdeQXVyMTY5Nzc4MDY@._V1_SX300.jpg,57,5.8,"$364,237",N/A
286,Nou fo,2021,N/A,13 Aug 2021,126 min,"Action, Crime",Benny Chan,"Benny Chan, Ryan Wai-Chun Ling, Yaoliang Tang","Donnie Yen, Nicholas Tse, Lan Qin","Cheung Sung-bong is an officer of the Regional Crime Unit who worked in the front line for many years. His protege, Yau Kong-ngo, respects him and manage to reach up to him. However, fate brings pits them against each other.",Cantonese,https://m.media-amazon.com/images/M/MV5BNmI5ZjRhNzYtNzZjYS00YWNjLWE2OWUtZTdiMDVlYTNlN2M4XkEyXkFqcGdeQXVyNDM1Nzc0MTI@._V1_SX300.jpg,N/A,7.2,"$383,234",N/A
287,The Dry,2020,R,21 May 2021,117 min,"Crime, Drama, Mystery",Robert Connolly,"Harry Cripps, Robert Connolly, Jane Harper","Eric Bana, Genevieve O'Reilly, Keir O'Donnell",Aaron Falk returns to his drought-stricken hometown to attend a tragic funeral. But his return opens a decades-old wound - the unsolved death of a teenage girl.,English,https://m.media-amazon.com/images/M/MV5BYzdlNzYzMjAtMGVjNi00Nzg4LTkzOTUtNTc0NmE2OTg0NDUwXkEyXkFqcGdeQXVyMTE1MzI2NzIz._V1_SX300.jpg,69,6.9,"$350,000",N/A
288,The Water Man,2020,PG,07 May 2021,91 min,"Adventure, Drama, Family",David Oyelowo,Emma Needell,"David Oyelowo, Amiah Miller, Lonnie Chavis",A boy sets out on a quest to save his ill mother by searching for a mythic figure said to have magical healing powers.,English,https://m.media-amazon.com/images/M/MV5BOWMzNzQ2YTctYmE1Ni00ZjUyLThlOWYtOGNhYmU1ZTkzOWIxXkEyXkFqcGdeQXVyMDM2NDM2MQ@@._V1_SX300.jpg,68,5.3,"$4,603,929",N/A
289,Bo Gia,2021,N/A,12 Mar 2021,128 min,"Comedy, Drama, Family","Tran Thanh, Ngoc Dang Vu","Ho Thuc An, Nhi Bui","Viet Anh, Aquay, Che Nguyen Quynh Chau","It centers around Sang, an old motorbike rider who lives in a low-income neighborhood in HCMC. Although Sang is poor and suffers from an illness, he always sacrifices himself for his family.",Vietnamese,https://m.media-amazon.com/images/M/MV5BY2ExMDIwYzAtOWE4YS00ZThkLTk1MDQtZTQ4YjViNzNlODk5XkEyXkFqcGdeQXVyNDc0Njc1NTY@._V1_SX300.jpg,N/A,6.8,"$308,976",N/A
290,Dutch,1991,PG-13,19 Jul 1991,107 min,"Comedy, Drama",Peter Faiman,John Hughes,"Ed O'Neill, Ethan Embry, JoBeth Williams","To get to know his girlfriend's son, a working-class good guy volunteers to pick him up from his prep school, only to learn that he isn't the nicest young man.",English,https://m.media-amazon.com/images/M/MV5BYmMzY2FhOTgtNjA1OC00ODIyLTgzNWYtMjMwNzUxZDA3NmY1XkEyXkFqcGdeQXVyNjMwMjk0MTQ@._V1_SX300.jpg,N/A,6.5,"$303,556",N/A
291,Final Account,2020,PG-13,21 May 2021,94 min,Documentary,Luke Holland,N/A,N/A,"An urgent portrait of the last living generation of Hitler's Third Reich in never-before-seen interviews raising vital questions about authority, conformity, national identity, and their own roles in the greatest human crimes in hist",German,https://m.media-amazon.com/images/M/MV5BNzkxNGJlZTYtZjNkNS00M2Y3LWE4MjAtNmJkMTE0ODgzY2E2XkEyXkFqcGdeQXVyMTkxNjUyNQ@@._V1_SX300.jpg,74,6.8,N/A,"Two Cities Films Ltd., Cineguild"
292,Nuevo orden,2020,R,21 May 2021,86 min,"Crime, Drama, Thriller",Michel Franco,Michel Franco,"Naian González Norvind, Fernando Cuautle, Diego Boneta",A lavish high-society wedding unexpectedly turns into a class struggle that leads to a violent coup.,"Spanish, English",https://m.media-amazon.com/images/M/MV5BOTcwNmM5MWItYmU5Mi00NmFkLWEwNmMtNWUxY2U1NTIzOWIwXkEyXkFqcGdeQXVyMDM2NDM2MQ@@._V1_SX300.jpg,62,6.4,"$282,332",N/A
293,Blithe Spirit,1945,Not Rated,14 May 1945,96 min,"Comedy, Fantasy",David Lean,"David Lean, Ronald Neame, Anthony Havelock-Allan","Rex Harrison, Constance Cummings, Kay Hammond",A man and his second wife are haunted by the ghost of his first wife.,"English, Spanish",https://m.media-amazon.com/images/M/MV5BN2FiNmJmN2MtNGYyOS00YzI2LWFjMTItZDUxZWFkNzg2MTUyL2ltYWdlL2ltYWdlXkEyXkFqcGdeQXVyNjc1NTYyMjg@._V1_SX300.jpg,N/A,7.1,"$264,626","WNET, ACT III Productions, Maramara Films, Artemis Rising Foundation"
294,American Skin,2019,R,15 Jan 2021,89 min,"Drama, Thriller",Nate Parker,Nate Parker,"Nate Parker, Omari Hardwick, Beau Knapp","A Marine veteran working as a school janitor tries to mend his relationship with his son after a divorce. When his son is killed by a police officer found innocent without standing trial, he takes matters into his own hands.",English,https://m.media-amazon.com/images/M/MV5BZDc4ZWU0NTgtNmIxNy00Yjk1LTg0OTctMWMxZjNjZjZhYmQ2XkEyXkFqcGdeQXVyMTEyMjM2NDc2._V1_SX300.jpg,24,6.8,"$254,775",N/A
295,Rita Moreno: Just a Girl Who Decided to Go for It,2021,PG-13,18 Jun 2021,90 min,Documentary,Mariem Pérez Riera,N/A,"Morgan Freeman, Marlon Brando, Lin-Manuel Miranda",A look at the life and work of Rita Moreno from her humble beginnings in Puerto Rico to her success on Broadway and in Hollywood.,English,https://m.media-amazon.com/images/M/MV5BZDI2NTNlYmYtYWI2MC00ZTM2LTkzZjYtNTVhMzc3MmRjNjhlXkEyXkFqcGdeQXVyMTAyMjQ3NzQ1._V1_SX300.jpg,79,7.7,"$14,230,455",N/A
296,Once I Was Engaged,2021,N/A,21 Jul 2021,107 min,Comedy,"Maclain Nelson, Stephen Shimek",Maclain Nelson,"Bart Johnson, Paris Warner, Clare Niederpruem","When Bree Carrington gets engaged while at BYU Hawaii, her loving but over-the-top mom goes all out to create the wedding of the century. But both mother and daughter must overcome the pressure of perfection when this happily ever af",N/A,https://m.media-amazon.com/images/M/MV5BYTdhMTIxYmMtMmM4YS00ODllLWE1M2YtMWUwMTk5MDVmYTJjXkEyXkFqcGdeQXVyNzc0MTgzMzU@._V1_SX300.jpg,N/A,7.1,"$2,160,710",Green/Renzi
297,Supernova,2000,PG-13,14 Jan 2000,90 min,"Horror, Sci-Fi, Thriller",Walter Hill,"William Malone, Daniel Chuba, David C. Wilson","James Spader, Peter Facinelli, Robin Tunney",A deep space rescue and recovery spaceship with a crew of 6 receives a distress call from a mining operation 3432 light years away. A rescue operation via dimension jump is made. Bad idea.,English,https://m.media-amazon.com/images/M/MV5BMTgwMjI4OTU4MF5BMl5BanBnXkFtZTcwOTk3MTE3NA@@._V1_SX300.jpg,19,4.9,"$232,641,920",N/A
298,Limbo,1999,R,07 Jul 1999,126 min,"Adventure, Drama, Thriller",John Sayles,John Sayles,"David Strathairn, Mary Elizabeth Mastrantonio, Vanessa Martinez","In an economically devastated Alaskan town, a fisherman with a troublesome past dates a woman whose young daughter does not approve of him. When he witnesses the murder of his shady brother, he, the woman and the kid run to the wilde",English,https://m.media-amazon.com/images/M/MV5BZTQwMGUzZDUtMGM2NC00ZDQ2LTg3NWEtNjZmZjNiOTU0OTM2XkEyXkFqcGdeQXVyNjMwMjk0MTQ@._V1_SX300.jpg,68,7.0,"$214,390",N/A
299,Doctor Strange,2016,PG-13,04 Nov 2016,115 min,"Action, Adventure, Fantasy",Scott Derrickson,"Jon Spaihts, Scott Derrickson, C. Robert Cargill","Benedict Cumberbatch, Chiwetel Ejiofor, Rachel McAdams","While on a journey of physical and spiritual healing, a brilliant neurosurgeon is drawn into the world of the mystic arts.",English,https://m.media-amazon.com/images/M/MV5BNjgwNzAzNjk1Nl5BMl5BanBnXkFtZTgwMzQ2NjI1OTE@._V1_SX300.jpg,72,7.5,"$211,467","Société Nouvelle de Cinématographie (SNC), Tritone Cinematografica"
300,Together,2021,R,27 Aug 2021,92 min,"Comedy, Drama","Stephen Daldry, Justin Martin",Dennis Kelly,"James McAvoy, Sharon Horgan, Samuel Logan",A husband and wife are forced to re-evaluate themselves and their relationship through the reality of the COVID-19 lockdown.,English,https://m.media-amazon.com/images/M/MV5BMzg4YjZhOTEtZmI0NC00M2ExLThhMzUtNGVmN2UzODNmMDIxXkEyXkFqcGdeQXVyMTAyMjQ3NzQ1._V1_SX300.jpg,59,7.1,"$204,513",N/A
301,La piscine,1969,GP,01 Aug 1970,122 min,"Crime, Drama, Romance",Jacques Deray,"Jean-Claude Carrière, Jacques Deray, Alain Page","Alain Delon, Romy Schneider, Maurice Ronet","Lovers Marianne and Jean-Paul spend their vacation in a villa on the French Riviera near St-Tropez. Marianne invites her former lover, Harry, and his teenage daughter to stay. Tension rises between them, especially when Jean-Paul sed","French, English",https://m.media-amazon.com/images/M/MV5BZjIyZmI3NzMtYmFlMi00ODlmLWJhMDEtM2IxMWRmOWFlN2JkXkEyXkFqcGdeQXVyNDE0OTU3NDY@._V1_SX300.jpg,N/A,7.1,"$191,996",N/A
302,Ailey,2021,PG-13,23 Jul 2021,82 min,Documentary,Jamila Wignot,N/A,"Judith Jamison, Alvin Ailey, Bill T. Jones","An immersive portrait of dance pioneer Alvin Ailey, told through his own words and a new dance inspired by his life.",English,https://m.media-amazon.com/images/M/MV5BZDAzOWYzN2ItMTM0MS00OWU5LTkwZjctMjcwMTJmMmU0ZWVkXkEyXkFqcGdeQXVyMTAyMjQ3NzQ1._V1_SX300.jpg,79,6.8,N/A,N/A
303,The Resort,2021,N/A,12 Jul 2021,75 min,Horror,Taylor Chien,Taylor Chien,"Bianca Haase, Brock O'Hurn, Michael Vlamis","Four friends head to Hawaii to investigate reports of a haunting at an abandoned resort in hopes of finding the infamous Half-Faced Girl. When they arrive, they soon learn you should be careful what you wish for.",English,https://m.media-amazon.com/images/M/MV5BZWUzNDRmZDQtMmQ3Yi00YmJiLWFmMGEtNGZjMmFiZjIxYWM1XkEyXkFqcGdeQXVyMTEyNDk3MjY3._V1_SX300.jpg,N/A,3.0,N/A,N/A
304,Délicieux,2021,N/A,08 Sep 2021,112 min,Comedy,Éric Besnard,"Éric Besnard, Nicolas Boukhrief","Grégory Gadebois, Isabelle Carré, Benjamin Lavernhe","France, 1789, just before the Revolution. With the help of a surprising young woman, a chef who has been sacked by his master finds the strength to free himself from his position as a servant and opens the first restaurant.",French,https://m.media-amazon.com/images/M/MV5BMmVjODI0OWMtMjNiNi00NWZhLThmMTAtOTM2YmM2MzhjNTI5XkEyXkFqcGdeQXVyMzAzMzkzNTU@._V1_SX300.jpg,N/A,7.0,"$166,403","The Population, Loki Films, Sony Pictures Worldwide Acquisitions (SPWA), Black Bear Pictures, Zafiro Cinema"
305,Beans,2020,N/A,05 Nov 2021,92 min,Drama,Tracey Deer,"Tracey Deer, Meredith Vuchnich","Kiawentiio, Violah Beauvais, Rainbow Dickerson","Based on true events, Tracey Deer's debut feature chronicles the 78-day standoff between two Mohawk communities and government forces in 1990 in Quebec.",English,https://m.media-amazon.com/images/M/MV5BMmUwMDdmNTktZmJlNS00NWY2LWJjYWUtYTZiZjBjZWQ3YmJiXkEyXkFqcGdeQXVyMTI4NDMxNzYz._V1_SX300.jpg,N/A,6.9,"$156,552",N/A
306,I Carry You with Me,2020,R,08 Jul 2021,111 min,Drama,Heidi Ewing,"Heidi Ewing, Alan Page","Armando Espitia, Christian Vazquez, Michelle Rodríguez","Ambition and societal pressure propel an aspiring chef to leave his soulmate in Mexico and make the treacherous journey to New York, where life will never be the same.","Spanish, English",https://m.media-amazon.com/images/M/MV5BZGIwZjNjNzctYzMxMi00OTVjLWI5ODAtNTM4NGNhNjNiZWVlXkEyXkFqcGdeQXVyOTgxNDIzMTY@._V1_SX300.jpg,76,6.4,"$146,329",N/A
307,Shiva Baby,2020,Not Rated,02 Apr 2021,77 min,"Comedy, Drama",Emma Seligman,Emma Seligman,"Rachel Sennott, Danny Deferrari, Fred Melamed","At a Jewish funeral service with her parents, a college student runs into her sugar daddy.",English,https://m.media-amazon.com/images/M/MV5BM2Y5ZDg1MmMtNjJkYS00NmEzLTk0ZjAtMGUxOTIyMDVlNzM1XkEyXkFqcGdeQXVyNjY1MTg4Mzc@._V1_SX300.jpg,79,7.2,"$257,252",Renaissance Pictures
308,SAS: Red Notice,2021,R,16 Mar 2021,124 min,"Action, Thriller",Magnus Martens,"Laurence Malkin, Andy McNab","Sam Heughan, Ruby Rose, Andy Serkis",A small army of well trained criminals led by Grace Lewis have hijacked a train deep beneath the English Channel.,"English, French",https://m.media-amazon.com/images/M/MV5BYzVjMWU4OGUtNGEyZS00MjJiLWIzNTMtNDk1NDdmMDUwYTAyXkEyXkFqcGdeQXVyODk4OTc3MTY@._V1_SX300.jpg,N/A,5.1,"$142,817",N/A
309,The Reckoning,2002,R,04 Jun 2004,112 min,"Crime, Drama, Mystery",Paul McGuigan,"Barry Unsworth, Mark Mills","Willem Dafoe, Paul Bettany, Marián Aguilera","A priest on the lam takes up with a traveling band of actors, who then discover a murder has occurred and try to solve it by recreating the crime in a play.","English, Latin",https://m.media-amazon.com/images/M/MV5BMTI3NTY5Mzk0N15BMl5BanBnXkFtZTcwOTA1MDUyMQ@@._V1_SX300.jpg,49,6.5,"$1,012,153",N/A
310,Held,2020,N/A,09 Apr 2021,94 min,"Horror, Mystery, Thriller","Travis Cluff, Chris Lofing",Jill Awbrey,"Jill Awbrey, Bart Johnson, Travis Cluff",A couple's ailing marriage is put to the test when they are held hostage in an isolated vacation rental by an unseen Voice that commands their every move.,English,https://m.media-amazon.com/images/M/MV5BOGQ1YTIzMWItNGJlOC00ZmZhLTk3MTEtNmYyNWQ0M2JhNWQxXkEyXkFqcGdeQXVyMTEyMjM2NDc2._V1_SX300.jpg,46,5.2,"$132,500",N/A
311,No Man's Land,2001,R,19 Sep 2001,98 min,"Comedy, Drama, War",Danis Tanovic,Danis Tanovic,"Branko Djuric, Rene Bitorajac, Filip Sovagovic","Bosnia and Herzegovina during 1993 at the time of the heaviest fighting between the two warring sides. Two soldiers from opposing sides in the conflict, Nino and Ciki, become trapped in no man's land, whilst a third soldier becomes a","Bosnian, French, English, Serbian",https://m.media-amazon.com/images/M/MV5BMGFkNjNmZWMtNDdiOS00ZWM3LWE1ZTMtZDU3MGQyMzIyNzZhXkEyXkFqcGdeQXVyMTMxODk2OTU@._V1_SX300.jpg,84,7.9,"$428,300",N/A
312,Six Minutes to Midnight,2020,PG-13,26 Mar 2021,99 min,"Drama, Thriller",Andy Goddard,"Eddie Izzard, Celyn Jones, Andy Goddard","Nigel Lindsay, Judi Dench, Eddie Izzard","UK, Aug. 15, 1939: 17 days before WWII, an English teacher and his camera disappear on a coastal boarding school with 20 German teen girls. Miller gets the job 6 days later, secretly trying to find out what happened.","German, English",https://m.media-amazon.com/images/M/MV5BZGY1YWI4NzEtNmYyMS00NWFjLTk3YTgtNTkzNWFkZDlmNmZkXkEyXkFqcGdeQXVyMTE1MzI2NzIz._V1_SX300.jpg,48,5.8,"$17,530",N/A
313,After We Fell,2021,R,03 Sep 2021,99 min,Drama,Castille Landon,"Anna Todd, Sharon Soboil","Josephine Langford, Hero Fiennes Tiffin, Louise Lombard","Just as Tessa makes the biggest decision of her life, everything changes. Revelations about her family, and then Hardin's, throw everything they knew before in doubt and makes their hard-won future together more difficult to claim.",English,https://m.media-amazon.com/images/M/MV5BMTEzN2MxZWUtYTJkYS00NjU5LTk0ZjgtNzc1OTMwNWNjZGFkXkEyXkFqcGdeQXVyNjY1MTg4Mzc@._V1_SX300.jpg,N/A,5.0,"$125,930",N/A
314,Gaia,2021,R,18 Jun 2021,96 min,"Drama, Fantasy, Horror",Jaco Bouwer,Tertius Kapp,"Monique Rockman, Carel Nel, Alex van Dyk",An injured forest ranger on a routine mission is saved by two off-the-grid survivalists. What is initially a welcome rescue grows more suspicious as the son and his renegade father reveal a cultish devotion to the forest.,"English, Afrikaans",https://m.media-amazon.com/images/M/MV5BMWU0MzJiMWEtOWQyYi00YTZkLWExYWEtZDZkODRlZDliOTVhXkEyXkFqcGdeQXVyMTAyMjQ3NzQ1._V1_SX300.jpg,64,5.5,"$124,772",N/A
